[
  {
    "exercise_progression_metric_map_id": "epm_00001",
    "exercise_id": "ex_barbell_bench_press",
    "metric": "estimated_1rm_with_technique_gate",
    "priority_rank": 1,
    "use_case": "primary_progression_decision",
    "confidence_rating": "moderate"
  },
  {
    "exercise_progression_metric_map_id": "epm_00002",
    "exercise_id": "ex_barbell_bench_press",
    "metric": "load",
    "priority_rank": 2,
    "use_case": "supporting_context_or_tie_breaker",
    "confidence_rating": "low"
  },
  {
    "exercise_progression_metric_map_id": "epm_00003",
    "exercise_id": "ex_barbell_bench_press",
    "metric": "repetitions",
    "priority_rank": 3,
    "use_case": "supporting_context_or_tie_breaker",
    "confidence_rating": "low"
  },
  {
    "exercise_progression_metric_map_id": "epm_00004",
    "exercise_id": "ex_barbell_bench_press",
    "metric": "rir",
    "priority_rank": 4,
    "use_case": "supporting_context_or_tie_breaker",
    "confidence_rating": "low"
  },
  {
    "exercise_progression_metric_map_id": "epm_00005",
    "exercise_id": "ex_barbell_bench_press",
    "metric": "range_of_motion",
    "priority_rank": 5,
    "use_case": "supporting_context_or_tie_breaker",
    "confidence_rating": "low"
  },
  {
    "exercise_progression_metric_map_id": "epm_00006",
    "exercise_id": "ex_barbell_bench_press",
    "metric": "technique_quality",
    "priority_rank": 6,
    "use_case": "supporting_context_or_tie_breaker",
    "confidence_rating": "low"
  },
  {
    "exercise_progression_metric_map_id": "epm_00007",
    "exercise_id": "ex_cambered_barbell_bench_press",
    "metric": "estimated_1rm_with_technique_gate",
    "priority_rank": 1,
    "use_case": "primary_progression_decision",
    "confidence_rating": "moderate"
  },
  {
    "exercise_progression_metric_map_id": "epm_00008",
    "exercise_id": "ex_cambered_barbell_bench_press",
    "metric": "load",
    "priority_rank": 2,
    "use_case": "supporting_context_or_tie_breaker",
    "confidence_rating": "low"
  },
  {
    "exercise_progression_metric_map_id": "epm_00009",
    "exercise_id": "ex_cambered_barbell_bench_press",
    "metric": "repetitions",
    "priority_rank": 3,
    "use_case": "supporting_context_or_tie_breaker",
    "confidence_rating": "low"
  },
  {
    "exercise_progression_metric_map_id": "epm_00010",
    "exercise_id": "ex_cambered_barbell_bench_press",
    "metric": "rir",
    "priority_rank": 4,
    "use_case": "supporting_context_or_tie_breaker",
    "confidence_rating": "low"
  },
  {
    "exercise_progression_metric_map_id": "epm_00011",
    "exercise_id": "ex_cambered_barbell_bench_press",
    "metric": "range_of_motion",
    "priority_rank": 5,
    "use_case": "supporting_context_or_tie_breaker",
    "confidence_rating": "low"
  },
  {
    "exercise_progression_metric_map_id": "epm_00012",
    "exercise_id": "ex_cambered_barbell_bench_press",
    "metric": "technique_quality",
    "priority_rank": 6,
    "use_case": "supporting_context_or_tie_breaker",
    "confidence_rating": "low"
  },
  {
    "exercise_progression_metric_map_id": "epm_00013",
    "exercise_id": "ex_dumbbell_bench_press",
    "metric": "repetitions_at_load_and_rir",
    "priority_rank": 1,
    "use_case": "primary_progression_decision",
    "confidence_rating": "moderate"
  },
  {
    "exercise_progression_metric_map_id": "epm_00014",
    "exercise_id": "ex_dumbbell_bench_press",
    "metric": "load",
    "priority_rank": 2,
    "use_case": "supporting_context_or_tie_breaker",
    "confidence_rating": "low"
  },
  {
    "exercise_progression_metric_map_id": "epm_00015",
    "exercise_id": "ex_dumbbell_bench_press",
    "metric": "repetitions",
    "priority_rank": 3,
    "use_case": "supporting_context_or_tie_breaker",
    "confidence_rating": "low"
  },
  {
    "exercise_progression_metric_map_id": "epm_00016",
    "exercise_id": "ex_dumbbell_bench_press",
    "metric": "rir",
    "priority_rank": 4,
    "use_case": "supporting_context_or_tie_breaker",
    "confidence_rating": "low"
  },
  {
    "exercise_progression_metric_map_id": "epm_00017",
    "exercise_id": "ex_dumbbell_bench_press",
    "metric": "range_of_motion",
    "priority_rank": 5,
    "use_case": "supporting_context_or_tie_breaker",
    "confidence_rating": "low"
  },
  {
    "exercise_progression_metric_map_id": "epm_00018",
    "exercise_id": "ex_dumbbell_bench_press",
    "metric": "technique_quality",
    "priority_rank": 6,
    "use_case": "supporting_context_or_tie_breaker",
    "confidence_rating": "low"
  },
  {
    "exercise_progression_metric_map_id": "epm_00019",
    "exercise_id": "ex_incline_dumbbell_press",
    "metric": "repetitions_at_load_and_rir",
    "priority_rank": 1,
    "use_case": "primary_progression_decision",
    "confidence_rating": "moderate"
  },
  {
    "exercise_progression_metric_map_id": "epm_00020",
    "exercise_id": "ex_incline_dumbbell_press",
    "metric": "load",
    "priority_rank": 2,
    "use_case": "supporting_context_or_tie_breaker",
    "confidence_rating": "low"
  },
  {
    "exercise_progression_metric_map_id": "epm_00021",
    "exercise_id": "ex_incline_dumbbell_press",
    "metric": "repetitions",
    "priority_rank": 3,
    "use_case": "supporting_context_or_tie_breaker",
    "confidence_rating": "low"
  },
  {
    "exercise_progression_metric_map_id": "epm_00022",
    "exercise_id": "ex_incline_dumbbell_press",
    "metric": "rir",
    "priority_rank": 4,
    "use_case": "supporting_context_or_tie_breaker",
    "confidence_rating": "low"
  },
  {
    "exercise_progression_metric_map_id": "epm_00023",
    "exercise_id": "ex_incline_dumbbell_press",
    "metric": "range_of_motion",
    "priority_rank": 5,
    "use_case": "supporting_context_or_tie_breaker",
    "confidence_rating": "low"
  },
  {
    "exercise_progression_metric_map_id": "epm_00024",
    "exercise_id": "ex_incline_dumbbell_press",
    "metric": "technique_quality",
    "priority_rank": 6,
    "use_case": "supporting_context_or_tie_breaker",
    "confidence_rating": "low"
  },
  {
    "exercise_progression_metric_map_id": "epm_00025",
    "exercise_id": "ex_machine_chest_press",
    "metric": "repetitions_at_load_and_rir",
    "priority_rank": 1,
    "use_case": "primary_progression_decision",
    "confidence_rating": "moderate"
  },
  {
    "exercise_progression_metric_map_id": "epm_00026",
    "exercise_id": "ex_machine_chest_press",
    "metric": "load",
    "priority_rank": 2,
    "use_case": "supporting_context_or_tie_breaker",
    "confidence_rating": "low"
  },
  {
    "exercise_progression_metric_map_id": "epm_00027",
    "exercise_id": "ex_machine_chest_press",
    "metric": "repetitions",
    "priority_rank": 3,
    "use_case": "supporting_context_or_tie_breaker",
    "confidence_rating": "low"
  },
  {
    "exercise_progression_metric_map_id": "epm_00028",
    "exercise_id": "ex_machine_chest_press",
    "metric": "rir",
    "priority_rank": 4,
    "use_case": "supporting_context_or_tie_breaker",
    "confidence_rating": "low"
  },
  {
    "exercise_progression_metric_map_id": "epm_00029",
    "exercise_id": "ex_machine_chest_press",
    "metric": "range_of_motion",
    "priority_rank": 5,
    "use_case": "supporting_context_or_tie_breaker",
    "confidence_rating": "low"
  },
  {
    "exercise_progression_metric_map_id": "epm_00030",
    "exercise_id": "ex_machine_chest_press",
    "metric": "technique_quality",
    "priority_rank": 6,
    "use_case": "supporting_context_or_tie_breaker",
    "confidence_rating": "low"
  },
  {
    "exercise_progression_metric_map_id": "epm_00031",
    "exercise_id": "ex_incline_machine_press",
    "metric": "repetitions_at_load_and_rir",
    "priority_rank": 1,
    "use_case": "primary_progression_decision",
    "confidence_rating": "moderate"
  },
  {
    "exercise_progression_metric_map_id": "epm_00032",
    "exercise_id": "ex_incline_machine_press",
    "metric": "load",
    "priority_rank": 2,
    "use_case": "supporting_context_or_tie_breaker",
    "confidence_rating": "low"
  },
  {
    "exercise_progression_metric_map_id": "epm_00033",
    "exercise_id": "ex_incline_machine_press",
    "metric": "repetitions",
    "priority_rank": 3,
    "use_case": "supporting_context_or_tie_breaker",
    "confidence_rating": "low"
  },
  {
    "exercise_progression_metric_map_id": "epm_00034",
    "exercise_id": "ex_incline_machine_press",
    "metric": "rir",
    "priority_rank": 4,
    "use_case": "supporting_context_or_tie_breaker",
    "confidence_rating": "low"
  },
  {
    "exercise_progression_metric_map_id": "epm_00035",
    "exercise_id": "ex_incline_machine_press",
    "metric": "range_of_motion",
    "priority_rank": 5,
    "use_case": "supporting_context_or_tie_breaker",
    "confidence_rating": "low"
  },
  {
    "exercise_progression_metric_map_id": "epm_00036",
    "exercise_id": "ex_incline_machine_press",
    "metric": "technique_quality",
    "priority_rank": 6,
    "use_case": "supporting_context_or_tie_breaker",
    "confidence_rating": "low"
  },
  {
    "exercise_progression_metric_map_id": "epm_00037",
    "exercise_id": "ex_cable_fly",
    "metric": "repetitions_at_load_and_rir",
    "priority_rank": 1,
    "use_case": "primary_progression_decision",
    "confidence_rating": "moderate"
  },
  {
    "exercise_progression_metric_map_id": "epm_00038",
    "exercise_id": "ex_cable_fly",
    "metric": "load",
    "priority_rank": 2,
    "use_case": "supporting_context_or_tie_breaker",
    "confidence_rating": "low"
  },
  {
    "exercise_progression_metric_map_id": "epm_00039",
    "exercise_id": "ex_cable_fly",
    "metric": "repetitions",
    "priority_rank": 3,
    "use_case": "supporting_context_or_tie_breaker",
    "confidence_rating": "low"
  },
  {
    "exercise_progression_metric_map_id": "epm_00040",
    "exercise_id": "ex_cable_fly",
    "metric": "rir",
    "priority_rank": 4,
    "use_case": "supporting_context_or_tie_breaker",
    "confidence_rating": "low"
  },
  {